,sentence,nmb_sent,author,title
0,"                    Военные Приключения                  ВОЕННОЕ ИЗДАТЕЛЬСТВО                       МИНИСТЕРСТВА ОБОРОНЫ СССР                             МОСКВА - 1964     * ЧАСТЬ ПЕРВАЯ *   ""ОСИНОЕ ГНЕЗДО""  1.",1,Георгий Михайлович Брянцев,"Конец ""Осиного гнезда"""
1,СВЯЗНИК ГАУПТМАНА ГЮБЕРТА       Телефонный звонок дошел наконец до моего сознания.,2,Георгий Михайлович Брянцев,"Конец ""Осиного гнезда"""
2,Я  вскочил  и подбежал  к  аппарату.,3,Георгий Михайлович Брянцев,"Конец ""Осиного гнезда"""
3,В  окне  уже  брезжил рассвет.,4,Георгий Михайлович Брянцев,"Конец ""Осиного гнезда"""
4,Вызывал к себе подполковник Фирсанов.,5,Георгий Михайлович Брянцев,"Конец ""Осиного гнезда"""
5,"Хотя за год  войны  пора  было  привыкнуть  ко всяким   неожиданностям,  я  все  же  встревожился  -  фронт  проходил недалеко,  всего в полусотне километров  отсюда.",6,Георгий Михайлович Брянцев,"Конец ""Осиного гнезда"""
6,"С  вечера,  когда  я отправлялся  на  квартиру,  никаких  непредвиденных заданий для меня в штабе партизанского движения как будто не  намечалось.",7,Георгий Михайлович Брянцев,"Конец ""Осиного гнезда"""
7,"Наоборот,  мне приказали  сутки  не  появляться  в  штабе,  пока не закончу обработку материалов,  которые собрал  во  время  своей  недавней  ходки  в  тыл противника.",8,Георгий Михайлович Брянцев,"Конец ""Осиного гнезда"""
