,sentence,nmb_sent,author,title
0,"         ""Оставьте, пожалуйста, это место таким же  чистым, каким  его нашли..."" Но это же  относится ко  всей Земле, а  не только к уборным!",1,Чингиз Абдуллаев,Сотвори себе мир
1,"И не ""такой  же чистой, какой ее нашли"", а какой хотели бы найти!",2,Чингиз Абдуллаев,Сотвори себе мир
2,Жильбер Сесброн.,3,Чингиз Абдуллаев,Сотвори себе мир
3,"""Счастье по пустякам""    Глава 1       Она лежала на  кровати  лицом вниз,  и  это избавляло от  необходимости смотреть ей  в глаза.",4,Чингиз Абдуллаев,Сотвори себе мир
4,Мартин  не любил смотреть  в  глаза покойникам.,5,Чингиз Абдуллаев,Сотвори себе мир
5,"В  них часто застывал  какой-то горестный  вопрос, словно жертва  отчаянно пыталась понять, почему именно  с ней судьба  обошлась столь несправедливо.",6,Чингиз Абдуллаев,Сотвори себе мир
6,"Иногда в глазах бывал и  ужас, но  это случалось  редко, только  в  том  случае, если убийца изощренно мучил свою жертву.",7,Чингиз Абдуллаев,Сотвори себе мир
