,sentence,nmb_sent,author,title
0,               Часть 1.,1,Валерий Горбань,Неуставной устав пехоты
1,Организация политико-воспитательной работы.,2,Валерий Горбань,Неуставной устав пехоты
2,"На высотах, что под Грозным,      Батальон один стоял.",3,Валерий Горбань,Неуставной устав пехоты
3,"Боевой, а не обозный -      С Дагестана воевал.",4,Валерий Горбань,Неуставной устав пехоты
4,"Строил теплые землянки,      Кашеварил и стирал,      На душманские подлянки      Адекватно отвечал:      По тревоге поднимаясь,      Открывал народ стрельбу      Звонким матом поминая      Нохчей, службу и судьбу.",5,Валерий Горбань,Неуставной устав пехоты
5,Ели кашу из перловки      Чтобы голод превозмочь.,6,Валерий Горбань,Неуставной устав пехоты
6,"Громкий гул артподготовки      Из землянок шел всю ночь...      Впрочем, быстро привыкали      К нравам полевым простым,      Только иногда стреляли      В них соседские посты.",7,Валерий Горбань,Неуставной устав пехоты
7,"Ночью тихой, да в тумане      С перепугу бьют на звук,      (Разберет ли новобранец -      Вражий выстрел, или ""пук""?)",8,Валерий Горбань,Неуставной устав пехоты
8,"В общем, было все обычно      По-российски, через зад,      Но нестрашно и привычно,      Стоек русский наш солдат!",9,Валерий Горбань,Неуставной устав пехоты
