,sentence,nmb_sent,author,title
0,"                 Итак,  мой давний друг Виталий Лосев погиб во второй серии телефильма ""Петля"", погиб вопреки сюжету этого  романа,  и  мне казалось, что он завершил свой путь не только на экране, но и в книгах.",1,Аркадий Адамов,Идет розыск
1,Однако не так-то просто оказалось расстаться со старым другом.,2,Аркадий Адамов,Идет розыск
2,"Сложные жизненные обстоятельства, сегодняшние важные  и острые  проблемы  и  человеческие  судьбы, которые так нанимают меня,  как  выяснилось,  мне  трудно   исследовать   с   новым, непривычным  героем.",3,Аркадий Адамов,Идет розыск
3,"И  потом,  вмешались  читатели.",4,Аркадий Адамов,Идет розыск
4,"Горячих и протестующих писем оказалось столько, что  это  тоже  заставило усомниться  в  разумности  гибели  моего  героя.",5,Аркадий Адамов,Идет розыск
5,"И вот Виталий Лосев, отбросив прискорбный экранный вариант,  вновь  действует на страницах нового романа.",6,Аркадий Адамов,Идет розыск
