,sentence,nmb_sent,author,title
0,"-        Посвящается Ю. М.       Действующие лица       Константин Львович Томский,      Управляющий кредитно-ссудным      Товариществом ""Добрый самарянин""       Вован,      Генеральный президент      Инвестиционно-маркетингового холдинга      ""Конкретика""       Зизи,      Жена Томского       Клавка,      Секретарша Вована       Вениамин Анатольевич Солодовников,      Председатель совета пайщиков      ""Доброго самарянина""       Колян,      Первый вице-президент ""Конкретики""       Птеродактор       Пыпа,      Председатель правления банка ""Евросервис""       Буревестник      Хранитель Музея      Господин в парике      Телохранители, мастеровые, грузчики, слуги       Сцена разделена на две части.",1,Борис Акунин,Зеркало Сен-Жермена
1,"Две комнаты, очень похожие одна на другую с лепниной и барельефами.",2,Борис Акунин,Зеркало Сен-Жермена
2,"Собственно, это одна и та  же  комната  старинного особняка, разделенная одним столетием.",3,Борис Акунин,Зеркало Сен-Жермена
3,"Слева - интерьер 1900 года: письменный стол с креслом, секретер.",4,Борис Акунин,Зеркало Сен-Жермена
4,В углу напольные часы XVIII века.,5,Борис Акунин,Зеркало Сен-Жермена
5,"На стене картина в золотой раме: некий господин с весьма примечательным лицом, в пудреном парике и с орденом Золотого Руна  на шее.",6,Борис Акунин,Зеркало Сен-Жермена
