,sentence,nmb_sent,author,title
0,--      * ЧАСТЬ ПЕРВАЯ *    НЕОЖИДАННЫЙ ГОСТЬ       Звонок был долгий.,1,Юрий Дольд-Михайлик,И один в поле воин
1,"В  другое  время  начальник  отдела 1-Ц,  оберст  Бертгольд,  вероятно, вскочил  бы с  дивана  и  бросился  к телефону.",2,Юрий Дольд-Михайлик,И один в поле воин
2,Но  на этот  раз он даже  не шевельнулся.,3,Юрий Дольд-Михайлик,И один в поле воин
3,"Бертгольд лежал,  как  и прежде, закрыв  глаза, и  можно  было подумать, что он спит.",4,Юрий Дольд-Михайлик,И один в поле воин
4,"Адъютант оберста гауптман Коккенмюллер уже несколько раз стучал в дверь кабинета; не дождавшись  разрешения  войти, он даже  чуть-чуть приоткрыл ее, но,  увидав оберста на  диване  с закрытыми глазами, тихонько закрыл  дверь, чтобы не нарушать отдых своего шефа.",5,Юрий Дольд-Михайлик,И один в поле воин
5,"Гауптман  знал,  что  его начальник прошедшей ночью  не спал.",6,Юрий Дольд-Михайлик,И один в поле воин
6,"Лишь под утро, после звонка  самого  Гиммлера,  он разрешил  себе немного  отдохнуть.",7,Юрий Дольд-Михайлик,И один в поле воин
