,sentence,nmb_sent,author,title
0,-        Глупость -- это хорошо скрытая форма счастья.,1,Василий Катунин,Возвращение Остапа Крымова
1,"Остап Крымов      (Полн. собр. соч. Т. 1, гл. 18)   ПРЕДИСЛОВИЕ       Будучи  маленьким  наивным  мальчиком,  я  смеялся  над  бедным  глупым Буратино,  зарывшим  свои  монеты в  землю.",2,Василий Катунин,Возвращение Остапа Крымова
2,"И только став  взрослым седеющим мужчиной,  я  понял,  что в  Стране  Дураков  действительно  растут  золотые деревья.",3,Василий Катунин,Возвращение Остапа Крымова
3,"В  этой книге столько  же вымысла,  сколько и  правды, ибо сама  жизнь, являясь невероятным выдумщиком, ежедневно стирает границы между реальностью, фантазией и бредом.",4,Василий Катунин,Возвращение Остапа Крымова
4,Мир  удивительно многообразен.,5,Василий Катунин,Возвращение Остапа Крымова
5,"И недостаток денег  у  людей  -- это не единственный  их недостаток, -- как людей, так и  денег.",6,Василий Катунин,Возвращение Остапа Крымова
6,"Все мы -- объекты, движущиеся в системе трех координат: деньги, секс, власть.",7,Василий Катунин,Возвращение Остапа Крымова
